clientSlug,sectionKey,label,value,detail,source,quote,kind,order
"martina","highlight","Streams","128K+","Écoutes cumulées sur les sorties actuellement actives.","","","","1"
"martina","highlight","Instagram","18K","Communauté visuelle engagée autour du projet.","","","","2"
"martina","highlight","Live","12","Dates privées, showcases et apparitions live récentes.","","","","3"
"martina","quote","","","","Editorial Note","Une voix soul contemporaine avec une direction visuelle assez forte pour tenir autant sur scène qu'en presse.","Press angle","1"
"martina","quote","","","","Booking Deck","Le projet Martina se distingue par une exécution premium, pensée pour des environnements live, brand et event haut de gamme.","Positioning","2"
